Reg Num,Name,Address,Status,Phone,Broker
3349,NORTHERN INSURANCE BROKERS INC,"1507, PARIS STREET, SUDBURY, ONTARIO, CANADA, P3E 3B7",Corporation,+1(705)522-7900,"MCGREGOR, RAY"
4121,NORTHLIFE INSURANCE & FINANCIAL SERVICES INC.,"55, CASTLEMORE AVE, MARKHAM, ONTARIO, CANADA, L6C 2N9",Corporation,+()647-997-7290,"GAKHAR, PRANAV"
4059,NUERA INSURANCE INC.,"6120, 2 SE ST, 25, CALGARY, ALBERTA, CANADA, T2H 2L8",Corporation,+1(403)854-0700,"BOSCH, BRADEN"
1647,O.K.J. INSURANCE BROKERS LIMITED,"3650, VICTORIA PARK AVENUE, SUITE # 203, NORTH YORK, ONTARIO, CANADA, M2H 3P7",Corporation,+1(416)492-4400,"DAVE-D'SOUZA, MANISHA"
4072,O2 INSURANCE SERVICES INC.,"3201, 308-4TH AVENUE, SW, CALGARY, ALBERTA, CANADA, T2P 0H7",Wholesaler / MGA,+1(778)777-5668,"MCGEE, KAREN PATRICIA"
4,OEGEMA-NICHOLSON-ORLEANS,"3809, ST. JOSEPH BLVD., UNIT 3, ORLEANS, ONTARIO, CANADA, K1C 1T1",Corporation,613-590-7373,"OEGEMA, BART T."
4080,OGILVY & OGILVY INC.,"55 YORK STREET, STE 200, TORONTO, ONTARIO, CANADA, M5J 1R7",Corporation,+1(416)777-2722,"OGILVY, DAVID W."
3764,OMA INSURANCE INC.,"150 BLOOR ST WEST, 8TH FLOOR, TORONTO, ONTARIO, CANADA, M5S 3C1",Corporation,+1(416)340-2993,"PALMER, BRUCE HARDING"
4083,ONE INSURANCE GROUP LTD.,"363, MAIN STREET, SELKIRK, MANITOBA, CANADA, R1A 1T5",Corporation,204-482-2300,"WYATT, CURTIS WILLIS"
4,ONE INSURANCE-WINNIPEG#2,"1115 GATEWAY ROAD, UNIT 6, WINNIPEG, MANITOBA, CANADA, R2G 0A5",Corporation,204-669-0143,"MCKENZIE, DONALD KENNETH"
4141,O'NEIL & BRADLEY'S INSURANCE LTD.,"1469, , STITTSVILLE MAIN ST, PO BOX 1234, STITTSVILLE, ONTARIO, CANADA, K2S 1B3",Corporation,+()613-432-4044,"ELLIOTT, STACY LEE"
4132,"ONESOURCE RISK MANAGEMENT CANADA, INC. / GESTION DE RISQUE ONESOURCE CANADA, INC.","15, NORTHTOWN WAY, SUITE 330, NORTH YORK, ONTARIO, CANADA, M2N 7A2",Corporation,+()866-463-4741,"BEEPAT, PETER"
3749,OPTIMA INSURANCE GROUP INC.,"1615, DUNDAS STREET EAST, SUITE 300, WHITBY, ONTARIO, CANADA, L1N 7S6",Corporation,+1(905)448-2929,"ALBANESE, DOMINIC"
4,OSTIC - FERGUS,"210, ST PATRICK ST W. , P.O. BOX 245 , FERGUS, ONTARIO, CAN",Corporation,519-843-2540,"OSTIC, JAMES ROBERT"
1674,OTIP/RAEO INSURANCE BROKERS INC.,"125, NORTHFIELD DRIVE WEST, P.O. BOX 218, WATERLOO, ONTARIO, CANADA, N2J 3Z9",Corporation,+1(519)888-9683,"FLOYD, CHRISTOPHER C."
2432,P.J. FAULKNER INSURANCE LTD.,"85 FERRIS LANE, SUITE 107, P.O. BOX 818, BARRIE, ONTARIO, CANADA, L4M 4Y6",Corporation,+1(705)726-1741,"FAULKNER, PERCY JAMES"
3447,PARMAR & ASSOCIATES INSURANCE BROKERS INC.,"106A BOND CRESCENT, RICHMOND HILL, ONTARIO, CANADA, L4E 3K9",Corporation,+1(905)508-3335,"MCCABE, JOSEPH VINCENT"
14,PARTNERS INDEMENTY MARKHAM,"84, PARKWAY AVENUE, MARKHAM, ONTARIO, CANADA,",Corporation,,"DOWNS, BARRY ROLAND"
514,PARTNERS INDEMNITY INSURANCE BROKERS LTD,"10, ADELAIDE STREET EAST, SUITE 400, TORONTO, ONTARIO, CANADA, M5C 1J3",Corporation,+1(416)366-5243,"DOWNS, BARRY ROLAND"
4,PARTNERS-KITCHENER(CHICOPEE),"328, CHICOPEE TRAIL, KITCHENER, ONTARIO, CANADA, N2R 4C8",Corporation,519-896-6625,"DOWNS, BARRY ROLAND"
4,PAUL AYOTTE-KIRKLAND,"27, GOVERNMENT ROAD WEST, KIRKLAND, ONTARIO, CANADA, P2N 2E3",Corporation,,"AYOTTE, MARTIN"
1433,PAUL MCGAHEY INSURANCE BROKERS LTD.,"14, REUBEN STREET, P.O. BOX 1337, KEMPTVILLE, ONTARIO, CANADA, K0G 1J0",Corporation,+1(613)258-3544,"MCGAHEY, PAUL MARTIN"
14,PBL- HEARST,"931, GEORGE STREET, HEARST, ONTARIO, CANADA, P0L 1N0",Corporation,705-372-6444,"WEERTS, ALBERT"
3584,PEDESTAL INSURANCE BROKERS INC,"44, BOND STREET EAST, P.O. BOX 190, FENELON FALLS, ONTARIO, CANADA, K0M 1N0",Corporation,+1(705)887-6318,"WOOLFREY, GLENN MALCOLM"
4002,PENTAGON INSURANCE GROUP INC.,"2201, WARDEN AVE, L1, SCARBOROUGH, ONTARIO, CANADA, M1T 1V5",Corporation,+1(905)995-0311,"MCCABE, JOSEPH VINCENT"
410,PETER CHUNG INSURANCE BROKERS LTD.,"1826, O'CONNOR DRIVE, TORONTO, ONTARIO, CANADA, M4A 1W7",Corporation,+1(416)755-9592,"CHUNG, PETER W H"
1245,PHIL LEON INSURANCE BROKER INC.,"21, HUNTER STREET EAST, #103, BOX 1053, HAMILTON, ONTARIO, CANADA, L8N 3R4",Corporation,+1(905)525-0001,"LEON, DAVID ARNOLD"
4111,PLAYER'S HEALTH COVER CANADA INC.,"52, HEDGEWOOD DR, UNIONVILLE, ONTARIO, CANADA, L3R 6K3",Corporation,+()416-574-6396,"GUTHRIE-PHAIR, LORIE J"
3046,PLLS CANADA INSURANCE BROKERS INC.,"FIRST CANADIAN PLACE, 100 KING STREET WEST, SUITE 5700, TORONTO, ONTARIO, CANADA",Corporation,+1(416)736-3456,"JONES, BRIAN WILLIAM"
2840,POWELL BROWN & TRACY INSURANCE BROKERS LIMITED,"1528, CRIMSON CRESCENT, KINGSTON, ONTARIO, CANADA, K7P 0H4",Corporation,+1(416)421-6489,"POWELL, BRUCE EDWARD"
2643,PREFERRED INSURANCE GROUP LIMITED,"778, WHARNCLIFFE ROAD SOUTH, LONDON, ONTARIO, CANADA, N6J 2N4",Corporation,+1(519)661-0200,"LENEHAN, ARTHUR MICHAEL"
3647,PRIME SERVICE INSURANCE O/B BT PARTNERS INC.,"8500 LESLIE ST, STE 200, THORNHILL, ONTARIO, CANADA, L3T 7P8",Corporation,+1(905)886-7277,"JAZAYERI-MOGHADDAS, DAVOOD"
3774,PRIMUS RISK MANAGEMENT INC.,"7111, SYNTEX DRIVE, 3RD FLOOR, MISSISSAUGA, ONTARIO, CANADA, L5N 8C3",Corporation,+1(647)499-6517,"ST. MARTIN, GILBERT J."
3455,PROFESSIONAL RISK UNDERWRITERS INC.,"1, YONGE STREET, SUITE 1801, TORONTO, ONTARIO, CANADA, M5E 1W7",Wholesaler / MGA,+1(416)306-2499,"MEHTA, RAHUL"
4,PROGRAMMED INS. - BEDFORD,"200, WATERFRONT DRIVE, SUITE #116, BEDFORD, NOVA SCOTIA, CANADA, B4A 4J4",Corporation,,"WATERS, TIMOTHY RICHARD"
1248,PROLINK INSURANCE INC.,"150, KING STREET WEST, TORONTO, ONTARIO, CANADA, M5H 1J9",Corporation,+1(416)595-7484,"MCCABE, JOSEPH VINCENT"
4081,PROTECT PLUS INSURANCE BROKERS INC.,"13013, TECUMSEH E RD, 3, WINDSOR, ONTARIO, CANADA, N8N 3T4",Corporation,+1(519)258-7733,"MCCABE, JOSEPH VINCENT"
1084,R. H. JOHNSTON INSURANCE BROKERS LTD.,"124, MAIN STREET, ST CATHARINES, ONTARIO, CANADA, L2N 4V4",Corporation,+1(905)934-3432,"JOHNSTON, ROGER HARVEY"
284,R.J. BROWN INSURANCE BROKER O/B 1731257 ONTARIO LIMITED,"88, LANSDOWNE STREET WEST, PETERBOROUGH, ONTARIO, CANADA, K9J 1Y1",Corporation,+1(705)876-1300,"MCDERMOTT, BRYAN EDWARD"
3924,RACINE & CHAMBERLAND INC.,"4001 CREMAZIE EAST, SUITE 100, MONTREAL, QUEBEC, CANADA, H1Z 2L2",Corporation,514-722-3501,"BOUSSEAU, BERNARD"
1804,RAYBURN INSURANCE BROKERS LTD.,"304, VICTORIA STREET NTH, P.O. BOX 639, TWEED, ONTARIO, CANADA, K0K 3J0",Corporation,+1(613)478-2532,"WOOLFREY, JAMES PAUL"
3642,RED ROCK INSURANCE SERVICES LTD.,"21, ST CLAIR E AVE, SUITE #504, TORONTO, ONTARIO, CANADA, M4T 1L8",Wholesaler / MGA,+1(647)401-3944,"GRAHAM, PETER CLARE"
4065,REEL MEDIA CANADA INC.,"33 YONGE STREET, STE 270, TORONTO, ONTARIO, CANADA, M5E 1G4",Wholesaler / MGA,+1(416)366-2223,"PEPPER, LYNNE"
2407,REG WARD INSURANCE SERVICES o/b 885002 ONTARIO LIMITED,"10, FRONT ST EAST, P.O. BOX 188, HASTINGS, ONTARIO, CANADA, K0L 1Y0",Corporation,705-696-3356,"MARTYN, ROBERT GORDON JAMES"
4000,"REINSURANCE MANAGEMENT ASSOCIATES, INC.","170 UNIVERSITY AVE, STE 500, TORONTO, ONTARIO, CANADA, M5H 3B3",Corporation,+1(416)408-2605,"DANIELS, CRISPIN"
4016,RELIABLE INSURANCE BROKERS INC.,"111, PACIFIC AVE, UNIT #1107, TORONTO, ONTARIO, CANADA, M6P 2P2",Corporation,+1(289)274-0024,"MCCABE, JOSEPH VINCENT"
1834,RHODES & WILLIAMS LIMITED,"1050, MORRISON DRIVE, 3RD FLOOR, OTTAWA, ONTARIO, CANADA, K2H 8K7",Corporation,+1(613)226-6590,"YOUNG, TRENTON ROY"
1941,RICHARD SCHWEGEL INSURANCE SERVICES LIMITED,"321, FREDERICK ST, KITCHENER, ONTARIO, CANADA, N2H 2N8",Corporation,+1(519)576-2020,"SCHWEGEL, NORMAN RICHARD"
4043,RICK BEER INSURANCE INC.,"163, ORMOND STREET, BROCKVILLE, ONTARIO, CANADA, K6V 2L2",Corporation,+1(613)342-9076,"MCCABE, JOSEPH VINCENT"
1848,RIDEAU INSURANCE SERVICE LTD,"P.O.BOX 160, 18 CONCESSION STREET, WESTPORT, ONTARIO, CANADA, K0G 1X0",Corporation,+1(613)273-2075,"RICE, SCOTT DAVID"
2734,RIDERS PLUS INSURANCE INC.,"80, NORTH QUEEN STREET, 5TH FLOOR, TORONTO, ONTARIO, CANADA, M8Z 2C9",Corporation,+1(416)251-1447,"SHARPE, MARY ANN PATRICIA"
4030,RISK CARE GENERAL INSURANCE INC.,"7895, TRANMERE DR, 30, MISSISSAUGA, ONTARIO, CANADA, L5S 1V9",Corporation,+1(905)805-5712,"MCCABE, JOSEPH VINCENT"
3249,RISK REVIEW INC.,"94, GRAHAM STREET SUITE 3, BOX 20137, WOODSTOCK, ONTARIO, CANADA, N4S 8X8",Consultant,+1(416)607-7251,"TRUSCOTT, DAVID G."
3400,RISKTECH INSURANCE SERVICES INC.,"#300, 14727 – 87 AVENUE, EDMONTON, ALBERTA, CANADA, T5R 4E5",Corporation,+1(780)453-7755,"PLOOF, JASON WAYNE"
4,RIVET- SAULT STE. MARIE,"150, CHURCHHILL BLVD., UNIT B5, SAULT STE MARIE, ONTARIO, CANADA, P6A 4B3",Corporation,705-949-1985,"RIVET, JEAN-LUC"
3054,ROBERT J. MORRIS INSURANCE & CONSULTING LTD.,"R.R. #2, ROAD 23, PROPERTY #235545, THAMESFORD, ONTARIO, CANADA, N0M 2M0",Corporation,+1(519)283-6608,"MORRIS, ROBERT JAMES"
3384,ROCKWELL INSURANCE BROKERS INC,"22, COTTINGHILL WAY, AURORA, ONTARIO, CANADA, L4G 7V4",Corporation,+1(905)726-1967,"MCCABE, JOSEPH VINCENT"
1124,ROGER KELSEY INSURANCE BROKERS INC.,"248, CHARLESTON LAKE ROAD, ATHENS, ONTARIO, CANADA, K0E 1B0",Corporation,+1(613)924-9135,"KELSEY, ROGER MAURICE"
3145,ROGERS INSURANCE LTD.,"800– 1331 MACLEOD TRAIL SE, CALGARY, ALBERTA, CANADA, T2G 0K3",Corporation,+1(403)296-2400,"ROGERS, PETER ROBERT"
3418,"ROSENBERG & PARKER OF CANADA, INC.","4211, YONGE STREET, SUITE #205, TORONTO, ONTARIO, CANADA, M2P 2A9",Corporation,+1(416)218-1280,"THOMPSON, SHEILA E."
3430,ROUTH CHOVAZ INSURANCE BROKERS INC.,"#203- 2351 ROYAL WINDSOR DRIVE, MISSISSAUGA, ONTARIO, CANADA, L5J 4S7",Corporation,+1(905)919-1382,"MCCABE, JOSEPH VINCENT"
1914,SAFETY INSURANCE SERVICE (1959) LIMITED,"2375, SKYMARK AVENUE, MISSISSAUGA, ONTARIO, CANADA, L4W 4Y6",Corporation,+1(416)259-4625,"TOSTE, M. FATIMA"
3489,SALVATORE INSURANCE BROKERS LIMITED,"1, PINE HILL DRIVE, UNIT 2, LOWER SACKVILLE, NOVA SCOTIA, CANADA, B4C 1N4",Corporation,+1(902)865-0025,"SALVATORE, JOHN DAVID"
14,SECURE - ELORA,"294, MILL STREET EAST, SUITE 1-12A, ELORA, ONTARIO, CANADA,",Corporation,,"MCGLYNN, RANDOLPH BRENT"
4,SECURE - ORANGEVILLE,"85, RIDDELL ROAD, ORANGEVILLE, ONTARIO, CANADA, L9W 4Z6",Corporation,519-940-0725,"MCGLYNN, RANDOLPH BRENT"
3674,SENTINEL RISK INSURANCE GROUP LIMITED,"193 AYLMER STREET NORTH, BOX 385, PETERBOROUGH, ONTARIO, CANADA, K9J 6Z3",Corporation,+1(705)742-4245,"KRUK, GREGORY R.J."
4013,SHARP INSURANCE O/B GEMSTAR HOLDINGS LTD.,"300- , 1331 MACLEOD TRAIL SE, CALGARY, ALBERTA, CANADA, T2G 1E1",Corporation,+1(403)590-2008,"ROGERS, PETER ROBERT"
1714,SHEPHERD GENERAL INSURANCE INC.,"140, WENDELL AVE., SUITE 9, TORONTO, ONTARIO, CANADA, M9N 3R2",Corporation,+1(416)249-1700,"SHEPHERD, NEIL WILLIAM"
4114,SHEPPARD INSURANCE SERVICE AND RISK MANAGEMENT INC.,"14315, 118 NW AVE, SUITE 118, EDMONTON, ALBERTA, CANADA, T5L 4S6",Corporation,+1(780)784-2582,"BAKER, CAMERON JAMES"
4,SHOLDICE-BRUSSELS,"470 TURNBERRY ST, BOX 69, BRUSSELS, ONTARIO, CANADA, N0G 1H0",Corporation,519-887-6100,"ORR, RICHARD"
2548,SIGNATURE INSURANCE BROKERS INC.,"111, ZENWAY BLVD, 39, WOODBRIDGE, ONTARIO, CANADA, L4H 3H9",Corporation,+1(905)264-0955,"LE, DUY PHAM"
4060,SLS INSURANCE BROKERS LTD.,"F120 - 155 FROBISHER DRIVE, WATERLOO, ONTARIO, CANADA, N2V 2E1",Corporation,+1(647)963-2520,"CARROLL, RANDY DAVID"
3624,SMITH & BRADLEY'S INSURANCE LTD.,"1518, SCOTT STREET, OTTAWA, ONTARIO, CANADA, K1Y 2N5",Corporation,+1(613)836-2473,"ELLIOTT, STACY LEE"
3643,SOUTH WESTERN INSURANCE GROUP LIMITED,"401, THE WEST MALL, SUITE #700, TORONTO, ONTARIO, CANADA, M9C 5J5",Wholesaler / MGA,+1(416)642-6976,"BARCLAY, JOHN ALEXANDER"
4,SOUTH WESTERN-HANNON,"64, SUNDANCE CRES, HANNON, ONTARIO, CANADA, L0R 1P0",Wholesaler / MGA,,"BARCLAY, JOHN ALEXANDER"
4012,SPADAFORA INSURANCE SERVICES INCORPORATED,"1275 WALKER ROAD, UNIT #9, WINDSOR, ONTARIO, CANADA, N8Y 4X9",Corporation,+1(226)348-0061,"MCCABE, JOSEPH VINCENT"
2043,SPEAKER & PIUNI LTD,"1224, GARRISON ROAD, P.O. BOX 1405, FORT ERIE, ONTARIO, CANADA, L2A 1P1",Corporation,+1(905)871-3594,"TUDHOPE, BROCKETT"
3874,SPECIAL RISK INSURANCE MANAGERS LTD.,"#103 - 8411 200TH STREET, LANGLEY, BRITISH COLUMBIA, CANADA, V2Y 0E7",Wholesaler / MGA,+1(604)888-0050,"WOODALL, WILLIAM MARK"
4,SPECIALTY RICK - WINNIPEG,"179, McDERMONT AVENUE, SUITE 108, WINNIPEG, MANITOBA, CANADA, R3B 0S1",Wholesaler / MGA,,"RISTOLA, MARK ALLEN"
4,SPRIGGS INS-ANGUS,"189, MILLS STREET , UNIT B , ANGUS, ONTARIO, CANADA,",Corporation,705-424-7191,"SPRIGGS, ROGER ADAM"
2048,SPRIGGS INSURANCE BROKERS LIMITED,"159, CHURCH STREET, OAKVILLE, ONTARIO, CANADA, L6J 1N1",Corporation,+1(905)844-9232,"SPRIGGS, ROGER ADAM"
4,ST CLAIR- LONDON,"127- , 4056 MEADOWBROOK, LONDON, ONTARIO, CANADA,",Corporation,519-691-2539,"MINGAY, JAMES PETER"
3654,ST. CLAIR INSURANCE BROKERS INC.,"133340, LANOUE ST, TECUMSEH, ONTARIO, CANADA, N8N 5E1",Corporation,+1(866)308-9307,"MINGAY, JAMES PETER"
543,STAN DARLING INSURANCE INC.,"178, ONTARIO STREET, BOX 540, BURKS FALLS, ONTARIO, CANADA, P0A 1C0",Corporation,+1(705)382-2902,"DARLING, JASON MYLES"
4,STEWART INSURANCE-PORT PERRY,"181, PERRY STREET, Unit G3, PORT PERRY, ONTARIO, CANADA, L9L 1B8",Corporation,,"MORRISON NICHOLLS, E. MARLENE"
4,STONERIDGE-MISSISSAUGA#1,"145, TRADERS E BLVD, 3, MISSISSAUGA, ONTARIO, CANADA, L4Z 3L3",Corporation,,"ANDERSON, TERRY VAUGHN"
41,SURNET-Bancroft,"294, Hastings St. N., BANCROFT, ONTARIO, CANADA, K0L 1C0",Corporation,613-332-3586,"THOMPSON, KELLY JEAN"
40,SURNET-Bowmanville,"28, Clayton Crescent, BOWMANVILLE, ONTARIO, CANADA, L1C 4P3",Corporation,905-623-2775,"THOMPSON, KELLY JEAN"
34,SURNET-Kitchener,"123, Stanley Ave., KITCHENER, ONTARIO, CANADA, N2K 3V9",Corporation,519-489-5051,"THOMPSON, KELLY JEAN"
43,SURNET-SCARBOROUGH,"707- , 88 GRANGEWAY AVENUE, SCARBOROUGH, ONTARIO, CANADA, M1H 0A2",Corporation,,"THOMPSON, KELLY JEAN"
42,SURNET-WATERLOO,"295 WEBER ST NORTH, UNIT #4, WATERLOO, ONTARIO, CANADA, N2J 3H8",Corporation,519-489-9051,"THOMPSON, KELLY JEAN"
3451,SUSSEX CORPORATE RISK INC.,"223 COLONNADE ROAD, STE 116, OTTAWA, ONTARIO, CANADA, K2E 7K3",Corporation,+1(613)224-0385,"GIANNOUKOS, GEORGE"
3840,SYM-TECH DEALER SERVICES O/B SYM-TECH INC.,"150, WEST BEAVER CREEK, RICHMOND HILL, ONTARIO, CANADA, L4B 1B4",Wholesaler / MGA,+1(416)801-4929,"MILDON, CHRISTOPHER"
3164,SYNERGY INSURANCE SERVICES INC,"16, BILTMORE COURT, MARKHAM, ONTARIO, CANADA, L3S 3S9",Corporation,416-238-1113,"HILLCOFF, KENNETH LESLIE"
4160,SYNERGY UNDERWRITERS LIMITED,"245, FAIRVIEW MALL DR, SUITE 302, NORTH YORK, ONTARIO, CANADA, M2J 4T1",Corporation,+()416-218-5775,"GUARINI, ANTONIO ""TONY"""
445,T.G. COLLEY & SONS LIMITED,"34, HARVARD ROAD, GUELPH, ONTARIO, CANADA, N1G 4V8",Corporation,+1(519)824-4040,"COLLEY, TODD ANDREW"
4,TANGRI BMT MISSISSAUGA,"7370, BRAMALEA ROAD, UNIT #17, MISSISSAUGA, ONTARIO, CANADA, L5S 1N6",Corporation,905-405-1200,"BERGERON, JOEL GERARD JOSEPH"
2134,TAYLOR FORDER INSURANCE BROKERS LTD.,"169, NORTH STREET, PORT PERRY, ONTARIO, CANADA, L9L 1B7",Corporation,+1(905)985-8416,"MICHEL, JENNIFER LYNN"
2141,TENCH-MACDIARMID INSURANCE BROKERS LTD.,"C/O J.G. RIVET BROKERS LIMITED, 229 MAIN STREET, STURGEON FALLS, ONTARIO, CANADA",Corporation,+1(705)753-0130,"RIVET, JEAN-LUC"
2604,THE MERIT GROUP INSURANCE BROKERS INC.,"759, HYDE PARK RD, 100, LONDON, ONTARIO, CANADA, N6H 3S3",Corporation,+1(519)657-5500,"PITCHELL, CRAIG S."
4,THE STANDARD - SIOUX LOOKOUT,"34, FRONT STREET, BOX 68, SIOUX LOOKOUT, ONTARIO, CANADA, P8T 1A1",Corporation,807-737-1580,"FORSYTH, GARY PETER"
3471,THE STANDARD INSURANCE BROKERS (RED LAKE) LTD.,"319 SECOND ST SOUTH, PO BOX 2890, KENORA, ONTARIO, CANADA, P9N 3X8",Corporation,8074683333,"FORSYTH, GARY PETER"
4046,THEJUDGE CANADA LIMITED,"120 ADELAIDE ST WEST, STE 2500, TORONTO, ONTARIO, CANADA, M5H 1T1",Corporation,+1(416)238-6730,"DANIELS, CRISPIN"
2149,THEORET MARTEL INSURANCE BROKERS,"1, MAIN E ST, HAWKESBURY, ONTARIO, CANADA, K6A 1A1",Partnership,+1(613)632-4118,"MARTEL, SHAWN THOMAS"
4105,THOMAS MILLER SPECIALTY UNDERWRITING AGENCY LIMITED,", PO BOX 61041, MAPLE GROVE VILLAGE, OAKVILLE, ONTARIO, CANADA, L6J 7P5",Wholesaler / MGA,+()647-746-7173,"MOOR, DEBORAH LEE"
4124,THUNDERBALL INVESTMENTS INC.,", BOX 77, RIDGEVILLE, ONTARIO, CANADA, L0S 1M0",Consultant,+1(905)732-8228,"MCAVOY, TIMOTHY GEORGE"
4113,TITAN INSURANCE BROKERS INC.,"20, MARITIME ONTARIO BLVD, STE 220, BRAMPTON, ONTARIO, CANADA, L6S 0E7",Corporation,+()905-799-9942,"SHEEHAN, EDWARD MICHAEL"
3634,TOPBIN INSURANCE SOLUTIONS INC.,"400, LAKE STREET, ST CATHARINES, ONTARIO, CANADA, L2N 4H4",Corporation,+1(877)633-9566,"CERCA, KAREN LEE"
4116,TREBUCHET INSURANCE BROKERS LTD.,"488, WELLINGTON W ST, SUITE 202, TORONTO, ONTARIO, CANADA, M5V 1E3",Corporation,+()416-203-2553,"MCGREGOR, JAMES"
3456,TREDD INSURANCE BROKERS INC.,"141, ADELAIDE ST WEST, SUITE 1410, TORONTO, ONTARIO, CANADA, M5H 3L5",Corporation,+1(416)306-2880,"SILVEIRA, ISABEL"
4087,Trehan & Associates Insurance Brokers Limited,"2780, SKYMARK AVE, UNIT #9, MISSISSAUGA, ONTARIO, CANADA, L4W 5A7",Corporation,+1(647)988-7012,"TREHAN, SATYAM"
2946,TRIBAL CUSTOM INSURANCE SERVICES INC.,"1000, DEGURSE DRIVE, SUITE 2, SARNIA, ONTARIO, CANADA, N7T 7H5",Corporation,+1(519)332-4894,"PETERS, BURK D."
4014,TRIDENT INSURANCE BROKERS INC.,"2978, ISLINGTON AVENUE, SUITE 203, NORTH YORK, ONTARIO, CANADA, M9L 2K6",Corporation,+1(416)775-9452,"OBERKOVYCH, MYKOLA (NICK)"
2184,TRIGON INSURANCE BROKERS LTD.,"2412, KALADAR AVE., OTTAWA, ONTARIO, CANADA, K1V 8C1",Corporation,+1(613)520-4108,"HA, JOSEPH"
3741,TRINITY UNDERWRITING MANAGERS LTD.,"55 YORK ST, STE 400, TORONTO, ONTARIO, CANADA, M5J 1R7",Wholesaler / MGA,+1(416)306-2857,"MCLACHLAN, MICHAEL STUART"
3084,TRI-QUEST MARKETING INC.,"291, UPPER HIGHLAND CRESCENT, NORTH YORK, ONTARIO, CANADA, M2P 1V4",Corporation,+1(416)930-0518,"LESLIE, JOHN DAVID"
3984,TUQUE INC.,"60 RENFREW DRIVE, STE 320, MARKHAM, ONTARIO, CANADA, L3R 0E1",Corporation,+1(647)505-5131,"ST. MARTIN, GILBERT J."
3574,UNIONLINK INSURANCE BROKERS INC.,"1-754 , FALCONBRIDGE HWY, SUDBURY, ONTARIO, CANADA, P3A 5X5",Corporation,855-530-9787,"MCGREGOR, RAY"
4161,UNIQUE RISKS LTD.,"1100, BURLOAK DR, SUITE 300, BURLINGTON, ONTARIO, CANADA, L7L 6B2",Wholesaler / MGA,+()905-334-6971,"FARQUHAR, JOHN D."
3834,UNITEDLINK INSURANCE BROKERS LTD.,"1390 KINGSWAY, UNIT 1, SUDBURY, ONTARIO, CANADA, P3B 0A3",Corporation,+1(705)222-5465,"MCGREGOR, RAY"
3524,UNITY MANAGING UNDERWRITERS LIMITED,"245, FAIRVIEW MALL DRIVE, SUITE #302, TORONTO, ONTARIO, CANADA, M2J 4T1",Corporation,+1(416)218-5775,"GUARINI, ANTONIO ""TONY"""
2204,UNITY REALTY & INSURANCE INC.,"229, GLEN PARK AVE, TORONTO, ONTARIO, CANADA, M6B 2E2",Corporation,+1(416)781-5638,"MINICUCCI, JEFFREY M."
3438,VEZINA ASSURANCE INC.,"4374, AVE PIERRE-DE COUBERTIN, MONTREAL, QUEBEC, CANADA, H1V 1A6",Corporation,+1(514)257-5155,"VEZINA, PATRICE"
3402,VP INSURANCE BROKERS LTD.,"14-260 , EDGELEY BLVD., CONCORD, ONTARIO, CANADA, L4K 3X4",Corporation,4163567124,"PISANO, VITO"
1453,W C MCLAUGHLIN LTD,"2950, KENNEDY ROAD, SUITE 201, SCARBOROUGH, ONTARIO, CANADA, M1V 1T1",Corporation,+1(416)299-4142,"TABOROWSKI, THOMAS G."
432,W. CLYDE ROBERTSON INSURANCE LIMITED,"5805, WHITTLE ROAD, SUITE 204, MISSISSAUGA, ONTARIO, CANADA, L4Z 2J1",Corporation,+1(905)890-6202,"ROBERTSON, PATRICK JOSEPH"
1947,W. H. SCRIVENS & SON LIMITED,"270, MACLAREN ST., OTTAWA, ONTARIO, CANADA, K2P 0M3",Corporation,+1(613)236-9101,"SCRIVENS, PETER WILLIAM"
244,W.C. BURGESS INSURANCE SERVICES LTD.,"16, CENTRAL AVENUE EAST, BROCKVILLE, ONTARIO, CANADA, K6V 1W4",Corporation,+1(613)342-1405,"FOAN, GREGORY WILLIAM"
1436,W.W.D. MCGLENNON INSURANCE BROKER LIMITED,"32, KING ST E, P.O.BOX 327, COLBORNE, ONTARIO, CANADA, K0K 1S0",Corporation,+1(905)355-2530,"MCGLENNON, DAVID W."
2274,WARDELL INSURANCE LTD.,"431, BRANT STREET, BURLINGTON, ONTARIO, CANADA, L7R 2G3",Corporation,+1(905)634-5549,"PINNINGTON, STEVE"
4131,WARNICA & ASSOCIATES INSURANCE INC.,"3602, HENSHAW PL, BURLINGTON, ONTARIO, CANADA, L7N 3X1",Corporation,+()905-632-5768,"MCCABE, JOSEPH VINCENT"
4076,WELLCARE INSURANCE CORPORATION,"50 WEST WILMOT STREET, UNIT 6, RICHMOND HILL, ONTARIO, CANADA, L4B 1M5",Corporation,+1(905)695-2080,"JAITLEY, RISHI"
4,WESTERN FINANCIAL-WEST KELOWNA,"108-3480 , CARRINGTON ROAD, WEST KELOWNA, BRITISH COLUMBIA, CANADA, V4T 3C1",Corporation,250-707-6810,"FRIESEN, JUSTIN A."
4031,WESTMOUNT GUARANTEE INSURANCE GROUP INC.,"600 COCHRANE DRIVE, STE 205, MARKHAM, ONTARIO, CANADA, L3R 5K3",Corporation,+1(416)366-3018,"PUDDY, MARC W.J."
4,WILL INS-TILBURY,"40, QUEEN STREET SOUTH, TILBURY, ONTARIO, CANADA, N0P 2L0",Corporation,,"WILL, DENNIS EDWARD"
2314,WILL INSURANCE BROKERS LTD,"148, ERIE STREET NORTH, LEAMINGTON, ONTARIO, CANADA, N8H 3A2",Corporation,+1(519)326-5746,"WILL, DENNIS EDWARD"
1844,WILLIS CANADA INC.,"100, KING STREET WEST, SUITE #4700, TORONTO, ONTARIO, CANADA, M5X 1E4",Corporation,+1(416)646-3187,"TORR, ANDREW EDWARD"
3497,WILLIS RE INC.,"100 King Street, , Suite 4700, TORONTO, ONTARIO, CANADA, M5X 1B5",Corporation,+1(212)915-8445,"LITTELL, DAVID JOSHUA"
4051,WILSON M. BECK INSURANCE SERVICES (KELOWNA) INC.,"ATTN: KAREN KILBREI, #1040- 250 WELLINGTON STREET, TORONTO, ONTARIO, CANADA, M5",Corporation,+1(250)878-3208,"KILBREI, KAREN ELAINE"
2342,WOODS HODGINS INSURANCE BROKER LIMITED,"170, AILSA CRAIG MAIN ST, PO Box 130, AILSA CRAIG, ONTARIO, CANADA, N0M 1A0",Corporation,+1(519)293-3295,"HODGINS, KEVIN R"
2344,WORDEN INSURANCE & FINANCIAL SERVICES LTD.,"172, KING STREET EAST, SUITE #300, OSHAWA, ONTARIO, CANADA, L1H 1B7",Corporation,+1(905)579-1317,"STANTON, DONALD BRUCE"
4,WYATT DOWLING-WINNIPEG,"1353, McPHILLIPS STREET, WINNIPEG, MANITOBA, CANADA, R2X 3A6",Corporation,204-949-2620,"FRIESEN, JUSTIN A."
3024,YORK ALLIANCE INSURANCE BROKERS INC.,"50, BUR OAK AVENUE, UNIT #5, MARKHAM, ONTARIO, CANADA, L6C 0A2",Corporation,+1(905)888-7900,"WOODROFFE, KEVIN"
24,YOUNGS INSURANCE-MISSISSAUGA,"2345, ARGENTIA ROAD, SUITE 100B, MISSISSAUGA, ONTARIO, CANADA,",Corporation,519-979-9989,"FERGUSSON, GORDON EDWARD"
4,YOUNGS INSURANCE-SAULT STE MAR,"126, GREAT NORTHERN ROAD, SAULT STE MARIE, ONTARIO, CANADA, P6B 4Z1",Corporation,705-759-9191,"FERGUSSON, GORDON EDWARD"
4,ZEHR INSURANCE - WATERLOO,"279, WEBER STREET NORTH, UNIT #16, WATERLOO, ONTARIO, CANADA, N2J 3H8",Corporation,519-746-5900,"ZEHR, JOHN GERRIT"
3954,ZENSURANCE BROKERS INC. O/A ZENSURANCE,"200, UNIVERSITY AVE, 1302, TORONTO, ONTARIO, CANADA, M5H 3C6",Corporation,+1(416)770-7674,"MCBRIDE, BENNETT E."
