Reg Num,Name,Address,Status,Phone,Broker
476,FRANK COWAN COMPANY LIMITED,"75, MAIN STREET NORTH, PRINCETON, ONTARIO, CANADA, N0J 1V0",Corporation,+1(519)458-4331,"SHEEDY, MATTHEW C."
3440,FRITH INSURANCE BROKERS INC.,"17817 LESLIE ST, STE 36, NEWMARKET, ONTARIO, CANADA, L3Y 8C6",Corporation,+1(905)895-5700,"MCCABE, JOSEPH VINCENT"
3436,FRONT ROW INSURANCE BROKERS INC.,"25, ADELAIDE E ST, 500, TORONTO, ONTARIO, CANADA, M5C 3A1",Corporation,+1(416)642-5200,"SCHLEIFER, DAMIAN DAVID"
1491,FSB GROUP LTD.,"385, CONNIE CRESCENT, CONCORD, ONTARIO, CANADA, L4K 5R2",Corporation,+1(905)731-5177,"BROWN, PAUL"
4,G&B ALLEN-COBOURG,"2 STRATHY ROAD,BOX #2,COMPT #7, COBOURG, ONTARIO, CANADA, K9A 5J3",Corporation,416-372-4207,"ALLEN, BRYCE PETER DUNCAN"
3641,GAME DAY INSURANCE INC.,"435 MCNEILLY ROAD, STE 203, STONEY CREEK, ONTARIO, CANADA, L8E 5E3",Wholesaler / MGA,+1(905)575-1122,"HOGAN, PATRICK FLOYD"
3794,GERALD SHTULL & ASSOCIATES O/B 3322653 CANADA INC.,"433 CHABANEL WEST, NORTH TW 1107, MONTREAL, QUEBEC, CANADA, H2N 2J9",Corporation,+1(514)939-6226,"SHTULL, JEFFREY"
3437,GIBB INSURANCE BROKERS INC.,"535, SANDWICH ST SOUTH, UNIT #4, AMHERSTBURG, ONTARIO, CANADA, N9V3G5",Corporation,+1(519)736-8228,"GIBB, CHRISTOPHER JOSEPH"
794,GIFFEN PIERCE & SINCLAIR INSURANCE BROKERS LIMITED,"11, CENTRE STREET WEST, STRATHROY, ONTARIO, CANADA, N7G 1T5",Corporation,+1(519)245-3335,"SINCLAIR, D MURRAY"
804,GILLONS' INSURANCE BROKERS LTD.,"326, CHURCH STREET, FORT FRANCES, ONTARIO, CANADA, P9A 1E1",Corporation,+1(807)467-8800,"McDONALD, TRACY RAE"
4,GILLONS'-SIOUX LOOKOUT,"76, FRONT STREET, Box 114, SIOUX LOOKOUT, ONTARIO, CANADA, P8T 1B7",Corporation,807-737-1818,"McDONALD, TRACY RAE"
3469,GLOBAL CREDIT RISK MANAGEMENT INC.,"524, ROUGEMOUNT CRESCENT, OTTAWA, ONTARIO, CANADA, K4A 2Z8",Corporation,+1(613)702-5343,"MIDDLETON, ROBERT JOHN"
3514,GROUPONE INSURANCE SERVICES INC.,"50, LEEK CRESCENT, SUITE 101, RICHMOND HILL, ONTARIO, CANADA, L4B 4J3",Wholesaler / MGA,+1(905)305-0852,"FRANKLIN, ADELINE KAYLA DON"
874,GUTHRIE INSURANCE BROKERS LIMITED,"505, CONSUMERS RD, 308, NORTH YORK, ONTARIO, CANADA, M2J 4V8",Corporation,+1(416)487-5200,"GUTHRIE, W. RYAN"
472,GUY COUGHLIN INS AGENCY LTD. O/A COUGHLIN INSURANCE BROKERS,"4-1170 , TAYLOR AVENUE, WINNIPEG, MANITOBA, CANADA, R3M 3Z4",Corporation,+1(204)953-4600,"COUGHLIN, MATTHEW DANIEL"
2054,H.L. STAEBLER COMPANY LIMITED,"871, VICTORIA STREET NORTH, KITCHENER, ONTARIO, CANADA, N2B 3S4",Corporation,+1(519)743-5221,"MENDONCA, JOANNA KIRSTY"
3495,"HAGERTY CANADA, LLC","37, SANDIFORD DRIVE, SUITE #409, STOUFFVILLE, ONTARIO, CANADA, L4A 7Z4",Corporation,+1(877)922-9701,"FLOYD, CHRISTOPHER C."
934,HB GROUP INSURANCE MANAGEMENT LTD.,"5600, CANCROSS COURT, MISSISSAUGA, ONTARIO, CANADA, L5R 3E9",Corporation,+1(905)507-8660,"WATCHORN, DANIEL CLINTON"
4,HB GROUP- MONCTON,"10, RECORD STREET, MONCTON, NEW BRUNSWICK, CANADA, E1C 0B2",Corporation,506-853-1215,"WATCHORN, DANIEL CLINTON"
942,HEINSOO INSURANCE BROKERS LTD.,"958, BROADVIEW AVENUE, SUITE 202, TORONTO, ONTARIO, CANADA, M4K 2R6",Corporation,+1(416)461-0764,"HEINSOO, THOMAS HILLAR"
944,HEITMANN INSURANCE BROKERS INC.,"700, CHRISLEA ROAD, WOODBRIDGE, ONTARIO, CANADA, L4L 8K9",Corporation,905-850-2500,"HEITMANN, PETER"
2914,HENRY EQUESTRIAN INSURANCE BROKERS LTD.,"53, PROSPECT STREET, NEWMARKET, ONTARIO, CANADA, L3Y3T1",Corporation,+1(905)294-0722,"MCGLYNN, RANDOLPH BRENT"
2554,HIROC INSURANCE SERVICES LIMITED,"4711, YONGE STREET, SUITE 1600, TORONTO, ONTARIO, CANADA, M2N 6K8",Corporation,+1(416)733-4915,"BROWN, HEATHER L."
2741,HKMB CAPITAL SOLUTIONS CORP.,"595, BAY STREET, SUITE 900, BOX 81, TORONTO, ONTARIO, CANADA, M5G 2E3",Corporation,+1(416)597-4626,"TINKER, MICHAEL C."
74,HOLMAN - TORONTO,"24, RIDGEWOOD AVENUE, TORONTO, ONTARIO, CANADA,",Corporation,,"HOLMAN, PAUL DAVID"
14,HOLMAN-MAPLE (R20778),"15, VIA LANCIANO ST., MAPLE, ONTARIO, CANADA, L6A 3P5",Corporation,905-417-7402,"HOLMAN, PAUL DAVID"
4,HOLMAN-THORN HILL (28023),"8, CEDAR FOREST CRT., THORN HILL, ONTARIO, CANADA, L3T 2A4",Corporation,,"HOLMAN, PAUL DAVID"
2415,HOPE AND LEADER INSURANCE BROKERS INC.,"365, QUEEN STREET, P.O. BOX 479, PAISLEY, ONTARIO, CANADA, N0G 2N0",Corporation,+1(519)353-5200,"LEADER, JOHN ALVIN"
3734,HRT INSURANCE CONSULTING INC.,"83, HIGHLAND WOODS COURT, LONDON, ONTARIO, CANADA, N6C 5X2",Consultant,+1(519)851-7247,"TOTTEN, H ROSS"
4,HUB INTERNATIONAL- RED DEER,"204 - 780, 50 AVENUE, RED DEER, ALBERTA, CANADA, T4P 1M8",Corporation,+1(416)597-4626,"TINKER, MICHAEL C."
24,HUB INTERNATIONAL-LONDON,"101, CHERRYHILL BLVD., UNIT 201, LONDON, ONTARIO, CANADA, N6G4W3",Corporation,+1(519)333-5839,"TINKER, MICHAEL C."
4,HUB INTERNATIONAL-WHEATLEY,"25, ERIE ST SOUTH, WHEATLEY, ONTARIO, CANADA, N0P 2P0",Corporation,+1(416)597-4626,"TINKER, MICHAEL C."
4,HUDSON SHIER-BRACEBRIDGE,"177, MANITOBA STREET, SUITE 101, BRACEBRIDGE, ONTARIO, CANADA, P1L 1S3",Corporation,705-645-1980,"FREYMOND, JONATHAN ANDREW"
2846,HUDSON-HENDERSON INSURANCE BROKERS LTD.,"12269, HWY. 35, P.O. BOX 910, MINDEN, ONTARIO, CANADA, K0M 2K0",Corporation,+1(705)286-4727,"FREYMOND, JONATHAN ANDREW"
2422,HUGH WOOD CANADA LTD.,"4120, YONGE STREET, SUITE 201, TORONTO, ONTARIO, CANADA, M2P 2B8",Corporation,+1(416)229-6600,"POOLE, DOUGLAS RICHARD"
674,HUNT & DOPSON INSURANCE GROUP INC.,"1, WILLIAM ST EAST, P.O. BOX 428, SMITHS FALLS, ONTARIO, CANADA, K7A 1C1",Corporation,+1(613)283-7776,"HUNT, RODERICK JOHN"
2492,HURON VIEW INSURANCE BROKERS LTD.,"226 QUEEN ST,, UNIT G3, KINCARDINE, ONTARIO, CANADA, N2Z 2S5",Corporation,+1(519)396-0539,"SCOTT, JAMES RAYMOND"
2491,HUTCHESON REYNOLDS & CASWELL INS.BRKS.(BRACEBRIDGE) LIMITED,"95 MANITOBA STREET, BOX 2616, CROCKFORD BLDG, UNIT #8, BRACEBRIDGE, ONTARIO, CAN",Corporation,+1(705)645-8757,"CASWELL, ADAM"
1024,HUTCHESON REYNOLDS & CASWELL LTD,"27, MAIN STREET EAST, HUNTSVILLE, ONTARIO, CANADA, P1H 2C6",Corporation,+1(705)789-0101,"CASWELL, ADAM"
4,HWC PORT STANLEY,"289, BRIDGE STREET, PORT STANLEY, ONTARIO, CANADA, N5L 1C2",Corporation,519-782-3327,"SPRAGUE, TODD D."
3403,ICON INSURANCE BROKERS LTD.,"1920 YONGE ST, STE 106, TORONTO, ONTARIO, CANADA, M4S 3E2",Corporation,+1(416)312-1340,"MANOLAKOS, ANASTASIA"
2647,IMPACT INSURANCE BROKERS INC.,"1600, STEELES AVENUE WEST, SUITE 214, CONCORD, ONTARIO, CANADA, L4K 4M2",Corporation,+1(905)660-6170,"WASSER, HOWARD"
3564,INROADS INSURANCE BROKERS INC.,"450, BRONTE STREET SOUTH, UNIT 113, MILTON, ONTARIO, CANADA, L9T 8T2",Corporation,+1(905)299-7671,"MACDONALD, JAMES NORMAN D."
3464,INSURANCE INSIGHT INC.,"1333, DORVAL DRIVE, SUITE #102, OAKVILLE, ONTARIO, CANADA, L6M 4G2",Corporation,+1(905)766-4613,"SPROULE, DAVID MICHAEL"
1040,INSURANCE PORTFOLIO INC.,"10, MILNER BUSINESS COURT, SUITE 800, SCARBOROUGH, ONTARIO, CANADA, M1B 3C6",Corporation,+1(416)754-3910,"TYRWHITT, JENNIFER"
1041,INSURANCE UNLIMITED INSURANCE BROKERS INCORPORATED,"145, TRADERS BOULEVARD EAST, SUITE 45, MISSISSAUGA, ONTARIO, CANADA, L4Z 3L3",Corporation,+1(905)568-3430,"STANDON, ROBERT DOUGLAS"
2459,INSURANCELAND INC.,"2585, SKYMARK AVENUE, SUITE 300, MISSISSAUGA, ONTARIO, CANADA, L4W 5A6",Corporation,+1(905)238-0668,"HAINER, PETER BYRON JOHN"
4119,INSUREGO INC.,"1439, YOUVILLE DR, UNIT #1, ORLEANS, ONTARIO, CANADA, K1C 4M8",Corporation,+()844-678-7346,"CARROLL, RANDY DAVID"
4,INSUREIT GROUP- BARRIE,"556 BRYNE DRIVE, UNIT 17B, , BARRIE, ONTARIO, CANADA, L4N 9P6",Corporation,705-797-2103,"PALERMO, ANTHONY"
4084,INSURELINE BROKERS (METRO) INC.,"4040, STEELES W AVE, 206, WOODBRIDGE, ONTARIO, CANADA, L4L 4Y5",Corporation,+1(416)548-7939,"ST. MARTIN, GILBERT J."
4068,INSURELINE BROKERS (OPTIMA) INC.,"144 FRONT STREET WEST, STE 200, TORONTO, ONTARIO, CANADA, M5J 2L7",Corporation,+1(888)806-8090,"ALBANESE, DOMINIC"
3934,INSURELINE BROKERS INC.,"2636, SHAUGHNESSY STREET, PORT COQUITLAM, BRITISH COLUMBIA, CANADA, V3C 3G6",Corporation,+1(604)695-7678,"KANJI, ALY"
4015,INSUREMY INC.,"150, 1300 8TH STREET SW, CALGARY, ALBERTA, CANADA, T2R 1B2",Corporation,+1(587)323-8493,"MCTAVISH, HUGH G."
3804,INSUREU! BROKERS INC.,"125, TOPFLIGHT DRIVE, MISSISSAUGA, ONTARIO, CANADA, L5S 1Y1",Corporation,+1(289)401-1810,"MAKKAR, SANJAY"
3943,INSUREWISE BROKERAGE INC.,"#715- 18 WYNFORD DRIVE, NORTH YORK, ONTARIO, CANADA, M3C 3S2",Corporation,+1(416)383-0901,"MCCABE, JOSEPH VINCENT"
1047,INTERRE INSURANCE SERVICES LIMITED,"56, ABERFOYLE CRESCENT, SUITE #820, TORONTO, ONTARIO, CANADA, M8X 2W4",Corporation,+1(416)239-8418,"GOLDBAUM, JOSE"
3847,IQ INSURANCE SERVICES O/B IQ INSURANCE INC.,"380 - 260, GRANVILLE ST, VANCOUVER, BRITISH COLUMBIA, CANADA, V6H 3V3",Corporation,+1(416)543-2409,"PROVENZANO, TIMOTHY"
3433,IRIDIUM RISK SERVICES INC.,"1100, BOW VALLEY SQUARE 3, 255 FIFITH AVENUE SW, CALGARY, ALBERTA, CANADA, T2P 3",Corporation,403-263-9654,"SWIERSTRA, ROGER LEO"
3742,IRONSHORE CANADA LTD.,"333, BAY STREET, SUITE 1120, TORONTO, ONTARIO, CANADA, M5H 2R2",Wholesaler / MGA,416-216-2273,"REID, ANDREW FRASER"
1499,IRVING H MILLER LTD,"267, KING STREET, PRESCOTT, ONTARIO, CANADA, K0E 1T0",Corporation,+1(613)925-4238,"MARTYN, ROBERT GORDON JAMES"
1048,IRWIN SARGENT & LOWES LIMITED,"441, WATER ST, PO BOX 1210, PETERBOROUGH, ONTARIO, CANADA, K9J 7H4",Corporation,+1(705)742-3861,"SARGENT, TODD WILLIAM"
154,ISURE INSURANCE INC.,"7000, PINE VALLEY DRIVE, SUITE #101, WOODBRIDGE, ONTARIO, CANADA, L4L 4Y8",Corporation,+1(905)264-8550,"DAVIDSON, ROBERT DONALD"
4,IVES INS- AMHERSTBURG,"38, VICTORIA STREET S., AMHERSTBURG, ONTARIO, CANADA, N9V 2J8",Corporation,519-736-7805,"IVES, JEFFREY MICHAEL"
1049,IVES INSURANCE BROKERS LTD.,"347, MAIDSTONE AVE EAST, PO BOX 369, ESSEX, ONTARIO, CANADA, N8M 2Y4",Corporation,+1(519)776-7371,"IVES, JEFFREY MICHAEL"
1405,J. STEPHEN MCCANN INSURANCE BROKER LTD.,"221, JOHN STREET, P.O.BOX 600, EGANVILLE, ONTARIO, CANADA, K0J 1T0",Corporation,+1(613)628-2610,"PLOTZ, TERESA BERNADETTE"
1394,J.J.McATEER & ASSOCIATES INCORPORATED,"45, MCINTOSH DRIVE, MARKHAM, ONTARIO, CANADA, L3R 8C7",Corporation,+1(905)946-8655,"McATEER, JOHN J."
547,J.S. DAVIDSON INSURANCE BROKERS LIMITED,"579, KINGSTON ROAD WEST, AJAX, ONTARIO, CANADA, L1S 6M1",Corporation,+1(905)683-8986,"DAVIDSON, WILLIAM J."
548,J.W. DAVIS INSURANCE BROKERS LIMITED,"987, CLARKSON ROAD S, UNIT #100, MISSISSAUGA, ONTARIO, CANADA, L5J 2V8",Corporation,+1(905)822-9660,"MCKENZIE, ROXANNE"
4,JARDINE LLOYD- GPL ASSURANCE,"1550, RUE METCALFE, SUITE #902, MONTREAL, QUEBEC, CANADA, H3A 1X6",Corporation,450-978-4446,"DANIELS, CRISPIN"
1064,JEFFERY & SPENCE LIMITED,"130, PAISLEY STREET, GUELPH, ONTARIO, CANADA, N1H 2P1",Corporation,+1(519)822-0511,"DI RETO, JASON ENZO"
2471,JMHI INSURANCE GROUP INC.,"550, RICHMOND STREET, CHATHAM, ONTARIO, CANADA, N7M 1R3",Corporation,+1(226)312-2020,"GAUDRAULT, JOSEPH ""ERIC"" DANIEL"
2264,JOHN S. WALKINGTON GENERAL INSURANCE INC.,"11399 KEELE STREET, UNIT 6, MAPLE, ONTARIO, CANADA, L6A 4E1",Corporation,+1(905)833-5283,"CAMPBELL, MARK DEREK"
42,"JOHNSON- AMHERST, NS","55, VICTORIA STREET, AMHERST, NOVA SCOTIA, CANADA, B4H 1X4",Corporation,,
45,"JOHNSON- ANTIGONISH, NS","149 CHURCH ST, STE 2, ANTIGONISH, NOVA SCOTIA, CANADA, B2G 2E2",Corporation,,
1074,JOHNSON- CORNWALL,"108, SECOND E ST, 1, CORNWALL, ONTARIO, CANADA, K6H 0C9",Corporation,,
43,"JOHNSON- DIEPPE, NB","1040 CHAMPLAIN ST, STE 200, DIEPPE, NEW BRUNSWICK, CANADA, E1A 8L8",Corporation,,
41,"JOHNSON- EDMONTON, AB","11120, 178TH STREET, EDMONTON, ALABAMA, CANADA, T5S 5K6",Corporation,,
46,"JOHNSON- FREDERICTON, NB","650, MONTGOMERY ST, FREDERICTON, NEW BRUNSWICK, CANADA, E3B 5C8",Corporation,,
47,JOHNSON- GRANDFALLS-WINDSOR,"5A HARRIS AVE, GRANDFALLS-WINDSOR, NEWFOUNDLAND AND LABRADOR, CAN",Corporation,,
1074,JOHNSON INC.,"1595, 16TH AVENUE, SUITE #700, RICHMOND HILL, ONTARIO, CANADA, L4B 3S5",Corporation,+1(905)952-2602,"CLEVELAND-ILIFFE, JULIA K."
34,JOHNSON- KANATA,"471, HAZELDEAN ROAD, SUITE 7, KANATA, ONTARIO, CANADA, K2L 4B8",Corporation,,
48,JOHNSON- PORT AUX BASQUE,"27, GRAND BAY ROAD, PORT AUX BASQUES, NEWFOUNDLAND AND LABRADOR, CANAD",Corporation,,
44,"JOHNSON- STEPHENVILLE, NL","42 QUEEN ST, STE 125, STEPHENVILLE, NEWFOUNDLAND AND LABRADOR, CANADA, A",Corporation,,
40,"JOHNSON- SYDNEY, NS","325, PRINCE STREET, SYDNEY, NOVA SCOTIA, CANADA, B1P 5K6",Corporation,,
49,"JOHNSON-CORNER BROOK, NL","1 MOUNT BERNARD AVE, UPPER LEVEL, CORNER BROOK, NEWFOUNDLAND AND LABRADOR, CANAD",Corporation,,
14,JOHNSON-SHILLINGTON- LONDON,"561, SOUTHDALE ROAD E., UNIT 8A, LONDON, ONTARIO, CANADA, N6E 3M7",Corporation,519-681-9719,
4,JONES BROWN - STONEY CREEK,"435, MCNEILLY ROAD, SUITE 103, STONEY CREEK, ONTARIO, CANADA, L8E 5E3",Corporation,,"HAWKRIGG, JOHN RICHARD"
4,JONES DESLAURIER-COLLINGWOOD,"550, First Street, Unit 103, COLLINGWOOD, ONTARIO, CANADA, L9Y 1C1",Corporation,705-444-0065,"TOSTE, M. FATIMA"
2740,JONES DESLAURIERS INSURANCE MANAGEMENT INC.,"2375, SKYMARK AVENUE, MISSISSAUGA, ONTARIO, CANADA, L4W 4Y6",Corporation,416-259-4625,"TOSTE, M. FATIMA"
4,JOSSLIN - ELMIRA,"11, ARTHUR STREET SOUTH, ELMIRA, , CANADA,",Corporation,,"WAGLER, DONALD C"
4,JWK INSURANCE- BROOKLIN,"71, BALDWIN STREET, BROOKLIN, ONTARIO, CANADA, L1M 1A3",Corporation,905-425-0729,"KRUK, GREGORY R.J."
3347,KAFKA INSURANCE BROKERS LTD.,"2785, HOWARD AVENUE, WINDSOR, ONTARIO, CANADA, N8X 3X8",Corporation,+1(519)966-0714,"MCGREGOR, RAY"
4003,KBD INSURANCE INC. / ASSURANCE KBD INC.,"16766 RTE TRANSCANADIENNE, #501, KIRKLAND, QUEBEC, CANADA, H9H 4M7",Corporation,+1(514)636-0002,"COVENY KILLEN, CURTIS MICHAEL"
2942,KEITH STEWART INSURANCE LTD.,"376, ST CLAIR STREET, CHATHAM, ONTARIO, CANADA, N7L 3K2",Corporation,+1(519)352-6571,"STEWART, KEITH S"
1147,KIRBY & MASSON INSURANCE LTD.,"2378, HOLLYLANE DR, SUITE 203, OTTAWA, ONTARIO, CANADA, K1V 7P1",Corporation,+1(613)739-7562,"KIRBY, J. SCOTT"
3460,KMI BROKERS INC.,"1430, HURONTARIO STREET, UNIT A, MISSISSAUGA, ONTARIO, CANADA, L5G 3H4",Corporation,+1(905)486-0440,"KRATIUK, BEATA"
4099,KOCISKO J. INSURANCE BROKERS INC.,"614, RUE SAINT-JACQUES, 450, MONTREAL, QUEBEC, CANADA, H3C 1E2",Corporation,+()514-871-8000,"KOCISKO, TERRY JOSEPH"
4,KRG INSURANCE,"2450, VICTORIA PARK AVENUE, SUITE 700, TORONTO, ONTARIO, CANADA, M2J 4A2",Corporation,416-636-4544,"BABOUJIAN, ABRAHAM"
4147,KTX INSURANCE BROKERS INC.,"300, LINCOLN ST, UNIT #22, WELLAND, ONTARIO, CANADA, L3B 4N4",Corporation,+()416-351-2600,"MAY, DARRYL JAMES"
3047,KTX INSURANCE BROKERS LTD.,"300, LINCOLN ST, UNIT #22, WELLAND, ONTARIO, CANADA, L3B 4N4",Corporation,+1(416)351-2600,"MAY, DARRYL JAMES"
1480,L. MELKONIAN INSURANCE BROKERS INC.,"1955, CH DE LA COTE-DE-LIESSE, 201, SAINT-LAURENT, QUEBEC, CANADA, H4N 3A8",Corporation,+1(514)333-4630,"BOUTROS, MILAD"
1204,LANDRY MELLOW INSURANCE LTD.,"4, CLARA STREET, ORANGEVILLE, ONTARIO, CANADA, L9W 2H6",Corporation,+1(519)941-6001,"LANDRY, CHRISTOPHER TODD"
3243,LAREAU - COURTIERS D'ASSURANCE INC.,"4-707, RTE 219, NAPIERVILLE, QUEBEC, CANADA, J0J 1L0",Corporation,+1(450)245-3322,"SEGUIN, MATTHIEU"
4070,LES BELL INSURANCE BROKERS INC.,"46, ANN STREET, BRACEBRIDGE, ONTARIO, CANADA, P1L 2C1",Corporation,+1(705)646-9995,"MCCABE, JOSEPH VINCENT"
1246,LESLIE & GILES INSURANCE LIMITED,"19, SLAN AVENUE, SCARBOROUGH, ONTARIO, CANADA, M1G 3B1",Corporation,+1(416)289-4421,"RODGERS, JOHN S.M."
2400,LEVITT INSURANCE BROKERS LTD.,"1120, FINCH AVE WEST, SUITE #604, TORONTO, ONTARIO, CANADA, M3J 3H7",Corporation,+1(416)512-8060,"MOLDOVAN, MARCEL AUGUSTIN"
1479,LOUIS MEIER INSURANCE BROKERS LTD.,"160, CIDERMILL AVENUE, UNIT 5, CONCORD, ONTARIO, CANADA, L4K 4K5",Corporation,+1(416)398-2596,"BARKLEY, NANCY JANE"
1274,LUNDY INSURANCE INC.,"336, ST. CLAIR STREET, CHATHAM, ONTARIO, CANADA, N7L 3K1",Corporation,+1(519)352-6720,"LUNDY, JAMES ROBERT"
1549,LUSSIER DALE PARIZEAU INC.,"3601, HWY #7, SUITE #400, MARKHAM, ONTARIO, CANADA, L3R 0M3",Corporation,+1(819)503-4122,"METIVIER, MARIE-CLAUDE"
4,LUSSIER DALE PARIZEAU-SOREL,"80, AUGUSTA CRT, SOREL-TRACY, QUEBEC, CANADA, J3P 1A5",Corporation,,"METIVIER, MARIE-CLAUDE"
3472,M.C. CARROLL INSURANCE BROKERS INC.,"856, PEMBROKE ST EAST, PEMBROKE, ONTARIO, CANADA, K8A 3M2",Corporation,+1(613)735-2473,"EDMONDS, LISA"
4,MACLACHLAN-PARKHILL,"197, MAIN STREET , , PARKHILL, ONTARIO, CANADA",Corporation,519-294-6871,"HODGINS, KEVIN R"
4,MAGENTA INSURANCE,,Corporation,,"FAULCONER, DEREK"
2405,"MAIN, MUDIE, GOWAN &ASSOCIATES INSURANCE BROKERS INC.","1161, PELHAM ROAD, P.O. BOX 490, FONTHILL, ONTARIO, CANADA, L0S 1E0",Corporation,+1(905)892-5749,"MANNELLA, MARIO"
1324,MALLORY INSURANCE BROKERS LTD,"BOX 727, 45 COLLIER STREET, BARRIE, ONTARIO, CANADA, L4M 4Y5",Corporation,+1(705)728-6100,"MALLORY, DANIEL WILBERT"
1334,MANTHA INSURANCE BROKERS LIMITED,"295, MONTREAL ROAD, VANIER, ONTARIO, CANADA, K1L 6B8",Corporation,+1(613)746-1450,"MANTHA, FERNAND G"
3246,MARDON INSURANCE BROKERS (COQUITLAM) LTD.,"139-3000 , LOUGHEED HWY, WESTWOOD MALL, COQUITLAM, BRITISH COLUMBIA, CANADA, V3B",Corporation,604-464-1933,"GARRISON, GREGORY GLEN"
1342,MARHEN INSURANCE BROKERS LTD,"1100, SOUTH SERVICE ROAD, SUITE 217A, STONEY CREEK, ONTARIO, CANADA, L8E 0C5",Corporation,+1(416)255-3728,"MOOR, COLIN JEFFERY"
1344,MARKETOR INSURANCE BROKERS LTD,"10048, KEELE STREET, SUITE 201, MAPLE, ONTARIO, CANADA, L6A 1G3",Corporation,+1(905)832-1020,"DIPENTIMA, MARIO"
1347,MARLEAU BROS LIMITED,"111, MONTREAL ROAD, CORNWALL, ONTARIO, CANADA, K6H 1B2",Corporation,+1(613)932-0404,"LEFEBVRE, PIERRE"
4,MARSH- LONDON,"ONE LONDON PLACE, 255 QUEENS AVE, SUITE 2400, LONDON, ONTARIO, CANADA, N6A 5R8",Corporation,519-663-5061,"BERESFORD, LYNN LOUISE"
1354,MARSHALL & BULLOCH INSURANCE BROKERS LTD.,"41, COLBORNE STREET WEST, ORILLIA, ONTARIO, CANADA, L3V 2Y5",Corporation,+1(705)325-4234,"BULLOCH, VALERIE MAXINE"
2347,MARTIN & WRIGHT INSURANCE AND FINANCIAL SERVICES INC.,"2160, DUNWIN DR, 6, MISSISSAUGA, ONTARIO, CANADA, L5L 5M8",Corporation,+1(905)828-5544,"STAFFORD, GAIL ALISON"
4,MASTERS INS OTTAWA,"196, BRONSON AVENUE, STE 102, OTTAWA, ONTARIO, CANADA,",Corporation,,"CICCOLINI, MAX P."
4,mASTERS INS OTTAWA,"196, BRONSON AVENUE, 102, OTTTAWA, ONTARIO, CANADA,",Corporation,,"CICCOLINI, MAX P."
4,mASTERS INS OTTAWA,"196, BRONSON AVENUE, OTTAWA, ONTARIO, CANADA,",Corporation,,"CICCOLINI, MAX P."
4,MASTERS INSURANCE (OTTAWA),"255, MICHAEL COWPLAND DRIVE, UNIT 101-A, KANATA, ONTARIO, CANADA, K2M 0M5",Corporation,+1(905)738-4164,"CICCOLINI, MAX P."
3143,MASTERS INSURANCE (OTTAWA) LIMITED,"7501, KEELE STREET, SUITE #400, CONCORD, ONTARIO, CANADA, L4K 1Y2",Corporation,+1(905)738-4164,"CICCOLINI, MAX P."
4,MAY-MCCONVILLE INS- LUCKNOW,"634, CAMPBELL STREET, P.O. BOX 389, LUCKNOW, ONTARIO, CANADA, N0G 2H0",Corporation,519-528-3824,"SPROUL, DAVID"
1402,MCCALLUM & MISALE INSURANCE BROKERS LTD.,"549, STONECHURCH ROAD EAST, HAMILTON, ONTARIO, CANADA, L8W 3L2",Corporation,+1(905)385-3221,"MISALE, ANGELO"
1403,MCCAM INSURANCE BROKERS LIMITED,"292, KING STREET WEST, OSHAWA, ONTARIO, CANADA, L1J 2J9",Corporation,+1(905)579-0111,"MCINTOSH, RORIE SPENCE"
2845,MCCASLIN HORNE INSURANCE BROKERS INC.,"211, GUELPH STREET, SUITE #4, GEORGETOWN, ONTARIO, CANADA, L7G 5B5",Corporation,+1(905)877-8738,"MCCASLIN, GARY JOHN"
1407,MCCLELLAND INSURANCE BROKERS LIMITED,"350, RUTHERFORD ROAD SOUTH, SUITE 7, BRAMPTON, ONTARIO, CANADA, L6W 3P6",Corporation,+1(905)451-0755,"MCCLELLAND, JAMES ALLEN"
1413,MCCORMICK INSURANCE BROKERS LTD.,"3009, BRIDGEN ROAD, BRIDGEN, ONTARIO, CANADA, N0N 1B0",Corporation,+1(519)864-1293,"MCCORMICK, HEATH WAYNE"
1416,MCCULLOCH INSURANCE (1951) LTD.,"77, CENTRE STREET, SUITE 1, ESPANOLA, ONTARIO, CANADA, P5E 1S4",Corporation,+1(705)869-4333,"MCCULLOCH, ALLEN VICTOR ROBERT"
1418,MCCUTCHEON INSURANCE BROKERS INC.,"C/O MACKAY INSURANCE BROKERS INC, 211 DUNDAS STREET EAST, BELLEVILLE, ONTARIO, C",Corporation,+1(613)354-2555,"MACKAY, DAVID BRUCE"
1419,McDERMOTT INSURANCE BROKERS LIMITED,"14, VICTORIA STREET EAST, P.O. BOX 640, ALLISTON, ONTARIO, CANADA, L9R 1V8",Corporation,+1(705)435-5271,"FARQUHAR, ROBERT E."
1423,MCDONAGH INSURANCE BROKERS LTD.,"P.O. BOX 250, 573 CAMPBELL STREET, LUCKNOW, ONTARIO, CANADA, N0G 2H0",Corporation,+1(519)528-3423,"MCDONAGH, WAYNE EDWIN"
24,MCDOUGALL INS- CRYSLER,"12, QUEEN STREET, CRYSLER, ONTARIO, CANADA, K0A 1R0",Corporation,613-987-2117,"STANTON, DONALD BRUCE"
14,MCDOUGALL INS- NAPANEE,"90, INDUSTRIAL BLVD, NAPANEE, ONTARIO, CANADA, K7R 4B7",Corporation,613-254-2152,"STANTON, DONALD BRUCE"
1427,MCDOUGALL INSURANCE BROKERS LIMITED,"199 FRONT ST, STE 401, P.O. BOX 356, BELLEVILLE, ONTARIO, CANADA, K8N 5A6",Corporation,+1(613)966-7001,"STANTON, DONALD BRUCE"
4,MCDOUGALL-COBOURG,"951, ELGIN STREET WEST, P.O. BOX 187, COBOURG, ONTARIO, CANADA, K9A 4K5",Corporation,905-372-2776,"STANTON, DONALD BRUCE"
1431,MCFARLAN ROWLANDS INSURANCE BROKERS INC.,"503, YORK STREET, LONDON, ONTARIO, CANADA, N6B 1R4",Corporation,+1(519)679-5440,"HANCOCK, RODNEY DOUGLAS"
1431,MCFARLAN ROWLANDS-AYLMER,"84, JOHN STREET S., AYLMER, ONTARIO, CANADA, N5H 2C4",Corporation,+1(519)765-2930,"HANCOCK, RODNEY DOUGLAS"
1431,MCFARLAN ROWLANDS-DORCHESTER#2,"3, CALVERT PLACE , , DORCHESTER, ONTARIO, CANADA",Corporation,+1(519)268-7804,"HANCOCK, RODNEY DOUGLAS"
1431,MCFARLAN ROWLANDS-LONDON(YORK),"#3- 1570 HYDE PARK ROAD, LONDON, ONTARIO, CANADA, N6H 5L5",Corporation,+1(519)471-7152,"HANCOCK, RODNEY DOUGLAS"
1439,MCGOEY BROTHERS INSURANCE BROKERS LTD,"10, MILL ST EAST, TOTTENHAM, ONTARIO, CANADA, L0G 1W0",Corporation,+1(905)936-3441,"MCGOEY, EDWARD THOMAS"
1450,MCKEE & MCKEE INSURANCE BROKERS LTD,"385, THE WEST MALL, SUITE 217, ETOBICOKE, ONTARIO, CANADA, M9C 1E7",Corporation,+1(416)622-3774,"MCKEE, DAVID W.C."
1456,MCLEAN & DICKEY LTD,"174, WEST ST. SOUTH, ORILLIA, ONTARIO, CANADA, L3V 6L4",Corporation,+1(705)325-4461,"TISI, DANIELLE"
1540,MCLEAN HALLMARK INSURANCE GROUP LTD.,"184, FRONT STREET EAST, SUITE #601, TORONTO, ONTARIO, CANADA, M5A 4N3",Corporation,+1(416)364-4000,"BELYEA, JOHN NORMAN"
1469,MCR INSURANCE BROKERS LTD.,"15037, YONGE STREET, AURORA, ONTARIO, CANADA, L4G 1M3",Corporation,+1(905)713-1612,"HAWTIN, ROBERT BARRY"
1462,MCTAGGART WETTLAUFER INS BRKS INC. O/A EXCALIBUR INS GROUP,"68, ONTARIO ROAD, PO BOX 488, MITCHELL, ONTARIO, CANADA, N0K 1N0",Corporation,+1(519)348-9150,"ROY, JEFFREY"
1473,MCVEY INSURANCE SERVICE LTD,"8028, VICTORIA STREET, METCALFE, ONTARIO, CANADA, K0A 2P0",Corporation,+1(613)821-2524,"MCVEY, BARRY WINSTON"
1475,MEADOWVALE INSURANCE BROKERS LTD,"159, CHURCH STREET, OAKVILLE, ONTARIO, CANADA, L6J 1N1",Corporation,+1(905)826-5122,"SPRIGGS, ROGER ADAM"
2847,MEADWELL MOWAT & FENNELL INS AND FINANCIAL SERVICES,"413, DUNDAS STREET EAST, WHITBY, ONTARIO, CANADA, L1N 2J2",Partnership,+1(905)668-3579,"MEADWELL, KRISTEN LYNN"
4,MELOCHE MONNEX- HALIFAX,"6940, MUMFORD ROAD, SUITE #301, HALIFAX, NOVA SCOTIA, CANADA, B3L 0B7",Corporation,,"CHONG, ELAINE"
1489,MERIT INSURANCE BROKERS INC.,"111, GORDON BAKER ROAD, SUITE #100, NORTH YORK, ONTARIO, CANADA, M2H 3R1",Corporation,+1(416)497-5556,"VICKERS, CAROLYN"
4027,MERLIN UNDERWRITING INC.,"140, YONGE ST, 316, TORONTO, ONTARIO, CANADA, M5C 1X6",Wholesaler / MGA,+1(647)795-8128,"TOTTEN, H ROSS"
4032,MIKE BEATTIE INSURANCE O/B 1934702 ONTARIO INC.,"633 LIONS PARK DRIVE, UNIT #2, MOUNT BRYDGES, ONTARIO, CANADA, N0L 1W0",Corporation,+1(519)264-1341,"MEYER, LEENDERT JOHN"
4,MILLENNIUM CREDITRISK- ACTON,"36, WILLOW STREET N, ACTON, ONTARIO, CANADA, L7J 1Z7",Corporation,800-763-3499,"BLACK, DAVID J."
4,MILLER - CLIFFORD,"2, ELORA STREET, P.O.BOX 160, CLIFFORD, ONTARIO, CANADA, N0G 1M0",Corporation,519-327-8025,"FARRELL, TODD K."
4,MOLLER- RICHMOND HILL,"21-30 , WERTHEIM COURT, RICHMOND HILL, ONTARIO, CANADA, L4B 1B9",Corporation,,"MOLLER, JOHN DAVID"
4,MOORE HEMSWORTH -ZURICH,,Corporation,,"MOORE, DAVID ERNEST"
1545,MORISON & LAFFERTY INSURANCE BROKERS INC.,"1030, UPPER JAMES STREET, SUITE # 304, HAMILTON, ONTARIO, CANADA, L9C 6X6",Corporation,+1(905)318-1711,"MORISON, PETER"
4,MORISON INS-WATERFORD,"35, MAIN STREET, WATERFORD, ONTARIO, CANADA, N0E 1Y0",Corporation,519-443-8645,"MORISON, FREDERICK BRIAN"
4,MULTI RISK INS- MAHMOOD NASIR,"6045, CREDITVIEW ROAD, MISSISSAUGA, ONTARIO, CANADA, L5V 0B1",Corporation,416-424-4358,"SINGH, BHUPENDER (BEN)"
14,MULTI RISK INS-SUJATHA SIVAKAN,"66, QUANTUM STREET, MARKHAM, ONTARIO, CANADA, L3S 4J5",Corporation,416-846-3030,"SINGH, BHUPENDER (BEN)"
1774,MURPHY INSURANCE & FINANCIAL SERVICES INC.,"38, ELLEN STREET, UNIT #2, BARRIE, ONTARIO, CANADA, L4N 3A3",Corporation,+1(705)737-3630,"MURPHY, BRENT JOHN"
1584,MUSKOKA INSURANCE BROKERS LTD.,"320, MUSKOKA ST NORTH, P.O. BOX 400, GRAVENHURST, ONTARIO, CANADA, P1P 1T7",Corporation,+1(705)687-6606,"GARAGAN, DAVID ALLEN"
4,MY INSURANCE-WINDSOR,"4140, WALKER ROAD, UNIT #3, BUILDING C, WINDSOR, ONTARIO, CANADA, N8W 3T5",Corporation,519-946-1155,
4066,MYGROUP INSURANCE BROKER LIMITED,"100 MAIN ST, STE 2030, DARTMOUTH, NOVA SCOTIA, CANADA, B2X 1R5",Corporation,+1(902)434-7148,"REID, JAMES PATRICK"
14,NACORA -MARKHAM,"1, VALLEYWOOD DRIVE, SUITE 102, MARKHAM, ONTARIO, CANADA,",Corporation,,"FIORAVANTI-ASHIKWE, DIANNA MARIE"
1421,NEIL G. MCDONALD LIMITED,"3800, STEELES AVENUE W., SUITE #201E, WOODBRIDGE, ONTARIO, CANADA, L4L 4G9",Corporation,+1(416)226-1611,"COCCIA, JOSEPH J"
4145,NEOSHIELD INSURANCE BROKERS INC.,"835, O'CONNOR DR, EAST YORK, ONTARIO, CANADA, M4B 2S7",Corporation,+1(416)759-0636,"MCCABE, JOSEPH VINCENT"
1604,NEW WORLD INSURANCE SERVICES (ONTARIO) LIMITED,"3621 HIGHWAY 7 EAST,, SUITE 212, MARKHAM, ONTARIO, CANADA, L3R 0G6",Corporation,+1(905)513-1818,"KEUNG, ADAM WING-KING"
4061,NEWLINE CANADA INSURANCE LIMITED,"55 UNIVERSITY AVE, STE 1600, TORONTO, ONTARIO, CANADA, M5J 2H7",Wholesaler / MGA,+1(416)862-0162,
4,NEWMAN OLIVER - MARMORA,"P.O. BOX 339, 31 FORSITHE STREET, MARMORA, ONTARIO, CANADA, K0K 2M0",Corporation,613-472-2243,"NEWMAN, CALVIN GARY"
4096,NEXT WAVE INSURANCE CANADA CORP.,"40, EGLINTON E AVE, 200, TORONTO, ONTARIO, CANADA, M4P 3A2",Wholesaler / MGA,+()647-542-3252,"PUDDY, MARC W.J."
3814,NICKEL CITY INSURANCE BROKERS INC.,"1-754 , FALCONBRIDGE ROAD, SUDBURY, ONTARIO, CANADA, P3A 5X5",Corporation,+1(705)566-6715,"MCGREGOR, RAY"
